[
  {
    "objectId": "sun",
    "name": "Sun",
    "kind": "sun",
    "oneLine": "Our nearest star — a middle-aged G-type dwarf that drives all life and weather on Earth.",
    "whyItMatters": "The Sun fuses about 600 million tonnes of hydrogen into helium every second, releasing the energy that powers the biosphere. Its activity cycles affect GPS accuracy, satellite drag, and power grids, making solar awareness genuinely practical.",
    "quickFacts": [
      { "label": "Diameter", "value": "~1.39 million km (109× Earth)" },
      { "label": "Distance from Earth", "value": "~149.6 million km (1 AU)" },
      { "label": "Surface temperature", "value": "~5,500 °C" },
      { "label": "Age", "value": "~4.6 billion years" },
      { "label": "Spectral type", "value": "G2V" }
    ],
    "observationTips": [
      "Never look at the Sun with naked eyes or unfiltered optics — permanent eye damage can occur in seconds.",
      "Use certified solar filters (ISO 12312-2) or a pinhole projector to observe sunspots safely.",
      "At sunset or sunrise the orange disc is safe to glance at briefly, but sunspot detail requires a proper filter."
    ],
    "kidFriendlySummary": "The Sun is a giant ball of super-hot gas sitting at the centre of our Solar System. It's so big that about a million Earths could fit inside it! Its light and warmth travel 150 million kilometres to reach us in just over 8 minutes.",
    "sourceNotes": "NASA Solar Facts; ESA/SOHO mission data; IAU 2012 nominal solar constants."
  },
  {
    "objectId": "moon",
    "name": "Moon",
    "kind": "moon",
    "oneLine": "Earth's only natural satellite and the most closely studied body beyond our planet.",
    "whyItMatters": "The Moon stabilises Earth's axial tilt, moderates our seasons, and drives tides. It is the only celestial body beyond Earth visited by humans, and remains the most accessible target for future crewed exploration.",
    "quickFacts": [
      { "label": "Distance from Earth", "value": "~384,400 km (avg)" },
      { "label": "Diameter", "value": "~3,474 km" },
      { "label": "Orbital period", "value": "~27.3 days (sidereal)" },
      { "label": "Surface gravity", "value": "~1.62 m/s² (17% of Earth's)" },
      { "label": "Human landings", "value": "6 Apollo missions (1969–1972)" }
    ],
    "observationTips": [
      "The terminator (shadow boundary) is the best place to study craters — low-angle sunlight makes relief dramatic.",
      "Binoculars reveal major maria (dark lava plains) and mountain ranges clearly.",
      "New Moon evenings are ideal for deep-sky observing because the sky is darkest."
    ],
    "kidFriendlySummary": "The Moon is Earth's rocky neighbour in space. It has no air and is covered in craters from asteroid impacts. Every night it looks slightly different because of how sunlight hits it as it orbits us.",
    "sourceNotes": "NASA Lunar Reconnaissance Orbiter data; IAU Lunar Nomenclature; Apollo mission records."
  },
  {
    "objectId": "mercury",
    "name": "Mercury",
    "kind": "planet",
    "oneLine": "The smallest planet and the closest to the Sun — a world of extreme temperature swings.",
    "whyItMatters": "Mercury's unusually large iron core and proximity to the Sun make it a natural laboratory for testing theories of planetary formation and general relativity (its orbital precession confirmed Einstein's predictions).",
    "quickFacts": [
      { "label": "Distance from Sun", "value": "~57.9 million km (0.39 AU)" },
      { "label": "Diameter", "value": "~4,879 km" },
      { "label": "Day length", "value": "~59 Earth days (sidereal rotation)" },
      { "label": "Year length", "value": "~88 Earth days" },
      { "label": "Temperature range", "value": "-180 °C to +430 °C" }
    ],
    "observationTips": [
      "Mercury is never far from the Sun — look low in the west just after sunset or low in the east before sunrise.",
      "It is best seen around greatest elongation (its maximum angular distance from the Sun).",
      "Binoculars help, but avoid using them when the Sun is above the horizon."
    ],
    "kidFriendlySummary": "Mercury is the smallest planet in our Solar System and zips around the Sun faster than any other planet. Because it's so close to the Sun it gets super-hot during the day and freezing cold at night.",
    "sourceNotes": "NASA MESSENGER mission; JPL Solar System Exploration fact sheets."
  },
  {
    "objectId": "venus",
    "name": "Venus",
    "kind": "planet",
    "oneLine": "Earth's twin in size but a hellish world of thick acid clouds and crushing pressure.",
    "whyItMatters": "Venus is the brightest natural object in the night sky after the Moon. Its runaway greenhouse effect makes it the prime cautionary case study for climate science. Ancient navigators called it the 'Morning Star' and 'Evening Star'.",
    "quickFacts": [
      { "label": "Distance from Sun", "value": "~108 million km (0.72 AU)" },
      { "label": "Diameter", "value": "~12,104 km (95% of Earth's)" },
      { "label": "Surface temperature", "value": "~465 °C (hottest planet)" },
      { "label": "Day length", "value": "~243 Earth days (retrograde)" },
      { "label": "Apparent magnitude", "value": "up to −4.9" }
    ],
    "observationTips": [
      "Venus is brilliant enough to cast faint shadows — look for them on snow or white surfaces on clear nights.",
      "It shows phases like the Moon when viewed through binoculars or a small telescope.",
      "Best observed in twilight when the contrast between Venus and sky is comfortable for the eyes."
    ],
    "kidFriendlySummary": "Venus is the brightest 'star' you can see in the sky, but it's actually a planet! It's about the same size as Earth, but its thick, toxic atmosphere traps so much heat that it's even hotter than Mercury.",
    "sourceNotes": "NASA Magellan mission; ESA Venus Express; JPL planetary fact sheets."
  },
  {
    "objectId": "mars",
    "name": "Mars",
    "kind": "planet",
    "oneLine": "The Red Planet — a rusty desert world with the tallest volcano and longest canyon in the Solar System.",
    "whyItMatters": "Mars is the primary near-term target for human exploration. Evidence of ancient river valleys and lake beds suggests it once had liquid water, raising questions about past — and possibly present — microbial life.",
    "quickFacts": [
      { "label": "Distance from Sun", "value": "~227 million km (1.52 AU avg)" },
      { "label": "Diameter", "value": "~6,779 km (53% of Earth's)" },
      { "label": "Day length", "value": "~24 h 37 min" },
      { "label": "Year length", "value": "~687 Earth days" },
      { "label": "Moons", "value": "2 (Phobos, Deimos)" }
    ],
    "observationTips": [
      "Mars is distinctly reddish — easy to identify among the stars.",
      "Its brightness varies enormously: at opposition it can rival Jupiter; at its faintest it looks like a dim reddish star.",
      "A small telescope at opposition shows the polar ice cap and dark surface markings."
    ],
    "kidFriendlySummary": "Mars is called the Red Planet because of the rusty dust that covers it. It has the biggest volcano in the Solar System — Olympus Mons is three times taller than Mount Everest! Robots from Earth are exploring it right now.",
    "sourceNotes": "NASA Mars Exploration Program; ESA Mars Express; MRO and Perseverance rover data."
  },
  {
    "objectId": "jupiter",
    "name": "Jupiter",
    "kind": "planet",
    "oneLine": "The Solar System's largest planet — a gas giant with iconic storms and 95 known moons.",
    "whyItMatters": "Jupiter's gravity shapes the entire Solar System: it catapults comets and asteroids outward, acting as a 'cosmic shield.' Its moon Europa harbours a subsurface ocean considered one of the best candidates for extraterrestrial life.",
    "quickFacts": [
      { "label": "Distance from Sun", "value": "~778 million km (5.2 AU)" },
      { "label": "Diameter", "value": "~139,820 km (11× Earth)" },
      { "label": "Moons", "value": "95 confirmed" },
      { "label": "Great Red Spot", "value": "Storm > 150 years old, wider than Earth" },
      { "label": "Rotation", "value": "~10 hours (fastest of all planets)" }
    ],
    "observationTips": [
      "Jupiter is the brightest object in the night sky after the Moon and Venus — impossible to miss.",
      "Even 7×50 binoculars show the four Galilean moons as pinpoints of light.",
      "A small telescope reveals the cloud bands and occasionally the shadow transits of its moons."
    ],
    "kidFriendlySummary": "Jupiter is a massive ball of gas — so big that all the other planets could fit inside it! It has a giant storm called the Great Red Spot that has been swirling for hundreds of years. Its moon Europa might even have an ocean hidden under ice.",
    "sourceNotes": "NASA Juno mission; Galileo spacecraft data; IAU Minor Planet Center moon catalogue."
  },
  {
    "objectId": "saturn",
    "name": "Saturn",
    "kind": "planet",
    "oneLine": "The ringed jewel of the Solar System — a gas giant whose iconic rings are made of ice and rock.",
    "whyItMatters": "Saturn's rings — spanning ~270,000 km but only ~10–100 m thick — are the most spectacular structure visible from a backyard telescope. Its moon Titan has a thick atmosphere and lakes of liquid methane, making it a key target for astrobiology.",
    "quickFacts": [
      { "label": "Distance from Sun", "value": "~1.43 billion km (9.5 AU)" },
      { "label": "Diameter", "value": "~116,460 km (9× Earth)" },
      { "label": "Ring span", "value": "~270,000 km across, ~10–100 m thick" },
      { "label": "Moons", "value": "146 confirmed" },
      { "label": "Density", "value": "~0.69 g/cm³ (would float on water)" }
    ],
    "observationTips": [
      "Saturn's rings are visible in any telescope above ~25×; at 50× they are a jaw-dropping sight.",
      "The rings' tilt relative to Earth changes on a ~15-year cycle — the view varies significantly year to year.",